,Review,Rating
78,"Самый большой плюс - большой экран и относительно небольшие деньги по сравнению с другими флагманами типа самсунга и эпл. Экран очень качественный, никакой зернистости не видно. Многие жалуются на звук. Надо мелодию правильно подбирать. Я оставил стандартную люмия. Звук пробивается через рюкзак на спине на улице, где рядом проносятся автомобили со звуком взлетающего самолета. Так, что звук вполне громкий. Уж точно раза в три громче айфона. Айфон 4s даже при слабом использовании разряжался за сутки. Эта модель держит заряд неделю-полторы. Да, заряд он всегда показывает ниже 100, но держит его долго. Что касается функционала, то тут надо просто привыкнуть. Серфить по инету, слушать музыку, читать книги и иметь под рукой документы вполне можно. Вот, чтобы закачать фильм, а потом его спокойно посмотреть. Вот тут будут танцы с бубном. Но и на планшете самсунг с андройдом такая же вещь. В плане функциональности ios проще и лучше. Но в плане цены, качества и размеров люмия лучше. Я не собираюсь за 6 плюс 70 косарей выкидывать. Лучше за 14,5 штук люмия пользоваться. Плюс тут нет вирусов и вредных программ. Никто денег с винды не слупит и смартфон не взломает. Камеры снимают отлично. Две симки тоже замечательная штука. Программы можно найти, если терпения набраться. Замечательный аппарат за небольшие деньги.",5
79,"Купила за 8000р новую рст  -  витринный образец в пленочке.За 8000р-отличный аппарат.На больше не тянет особо.За эти деньги я им довольна-удобно читать,просматривать страницы браузера.Если он конечно загрузится.",3
80,"Периодически просит выбрать место записи по умолчанию. Понятия не имею зачем. Иногда начинает что-то сканировать или обновлять в режиме ожидания, так телефон даже не включить (хотя тут возможно виноват софт типа клин мастера, но, опять же, на LG такого не было). Есть ещё несколько очень мелких и незначительных косяков, в которым привыкаешь со временем, но всё же хорошего в этом всё равно мало. Возможно мне просто достался такой экземпляр, не знаю. Но в целом, телефон мне понравился только дизайном (у меня синий). Не рекомендую",3
81,покупать не рекомендую,3
82,,4
83,"В целом смарфон очень хороший,выполняет практически все свои функции,но из-за частой потери сети и подобного бага ,что был описан выше - смартфон можно использовать только без сим-карты ,как читалку или плеер.Пользуюсь данным аппаратом более года,и сильного разочарования не вызвал.Чехол для данного телефона просто нереально найти,как и пленку тоже,но мне повезло и пленочку купил сразу со смартофоном.",3
84,"свои деньги он окупает за полгода пользования подвергался падениям с разных высот ,но все работает идеально",5
85,"Итак, я уже около недели пользуюсь этим смартфоном и я в бешеном восторге! Это лучший телефон из которых у меня были! Скажу сразу, это мой третий смартфон, до этого пользовалась Nokia! Стильный, удобный, очень яркий! Также не могу не отметить это его скорость, летает просто! Скачала пару игрушек с play store и все работает без единого тормоза! Удобно пользоваться интернетом, старый добрый хром теперь у меня и в телефоне, очень легко, кстати, синхронизировались все закладки. Считаю, что  за такие деньги – это очень правильный выбор! Зашла в приложение LG appclub и скачала бесплатно!!! Ситигид! Теперь у меня аж 3 приложения, которые мне показывают путь – гугл, яндекс и ситигид. Оооочень порадовала батарея – целый день активного пользования (музыка, игры, навигатор, соц. сети) и под вечер остается еще около 35%! Когда у молодого человека без подзарядки даже до вечера не доживает.",5
86,"Если Вам достаточно 64 Gb, то лучше посмотреть в сторону 5S. По быстродействию практически не отличаются.",4
87,"Отличная модель, крепкая не только на вид, но и в деле. Ношу без чехла уже пару месяцев - ни одной царапины. Телефон очень шустрый, никаких лагов, что бесконечно радует. Если телефон постоянно в руках - то в соцсетях, то звонки, то фото, -зарядки хватает на сутки. При умеренном использовании на двое суток максимум. Геолокацию включаю только на улице. 3D Touch включен всегда и это очень удобно! Фото просто отличные как макро, так и обычная съемка. Очень понравился ручной режим осветления фото, снятых например в ночное время суток.Редактирую отзыв после установки игры/ 27.05.16Это просто жесть как игра жрет батарею!!! Ну никуда не годится((( 20% зарядки за час игры! Отнимаю балл",4
88,"Я не поклонник Apple, когдато по глупости купила 5, но жутко непривычно было для меня было после андроида, там красив только дизайн, но никакого удобства. К этому девайсу я тоже относилась скептически, пока не опробовала его.Очень приятное и громкое звучание музыки. Хорошая камера, при дневном свете выдает качественные снимки. экран, все жалуются что не фул хд, не знаю, очень приятные цвета, пикселей не видно.Габариты устраивают, удобно держать одной рукой, печатать тоже. Единственное, что не продумали - он очень скользкий. Обязательно какой-нибудь нескользящий чехол.Проблем со сборкой не обнаружила.Аккумулятор оставляет желать лучшего, но это же айфон) купил айфон - научись и зарядку носить с собой)да и к ios можно привыкнуть.Советую, но не для понтов, так как за такие деньги можно купить аппарат намного помощнее.",5
89,"телефон вполне устраивает, все работает стабильно, редко подглючивает при включении камеры(картинка зависает) но скидываешь перезаходишь и все в норме, пользуюсь 10 месяцев",5
90,"Купила iPhone 6 вместо Samsung galaxy s6. Странно, но кореец мне быстро надоел, несмотря на классную начинку и неплохой дизайн. Ещё и батарейка стала садиться быстро. Едва стало хватать на световой день. Приходилось сбрасывать телефон на заводские настройки, потом устанавливать минимум программ. Только после этого ситуация немного улучшалась, но все познаётся в сравнении. У iPhone 6 батарейка реально держит намного лучше. На эконом режиме у Самсунг телефон разряжался одинаково быстро. То ли дело iPhone 6 на iOS 9.0. Пишу мини-отзыв уже более 15 минут, а батарейка упала всего на 2%. На самсунге за это время батарейка съела бы заряд 5-7%. Все время вдалбливаю себе в голову, что топовые андроид смартфоны уже ни в чем не уступают, и зачастую, даже превосходят iPhone 6, но на практике у меня выходит иначе.)В принципе, iPhone 6 очень хороший смартфон. Он не идеальный, но до сих пор является одним из лучших на рынке, несмотря на обилие новых андроид флагманов.",5
91,"В целом доволен покупкой. Если любите пофоткаться, посмотреть фильмы и поиграть в игрушки на iPhone, то 16 ГБ будет маловато. И пару слов про американский айфон и айфон ростестовский. Разницы между ними нет, кроме вилки зарядника и одной из частот LTE, так что можете брать себе любой. На iPhone 6 стоит однозначно переходить с предыдущих версий телефонов от Apple, кроме владельцев 5s, там уже конкретно каждый пусть решает для себя сам. ИМХО, т. к. все равно через год уже будет iPhone 7 и пока неясно чем же на этот раз сможет удивить придирчивого покупателя компания из Купертино.",4
92,"Купил прошлой осенью, эйфория от покупки длилась недолго, обнаружился брак. В магазине сразу же заменили на новый, и вроде бы 9 месяцев все было хорошо. Но, совсем недавно, случайно присмотревшись к фронтальной камере, заметил её смещение. После недолгих раздумий отправился в АСЦ Apple, где мне вежливо и доходчиво все объяснили. Через неделю мне прислали новый аппарат, но и тут история не закончилась. Спустя 2 недели я вновь вернулся в АСЦ, где прождал ещё неделю, и снова получил новый аппарат. После стольких замен, устройством пользовался неуверенно, уже не чувствовал той надежности что раньше. Но все же хотелось бы отметить отличную работу поддержки Apple.",4
93,"В целом покупкой доволен. Конечно, цена довольно высокая, но если деньги есть - брать нужно однозначно. Самый приятный плюс это конечно дисплей...Походив с шестым начинаешь удивляться, какой же маленький дисплей у 5-ки...) Единственное, что не оправдало ожиданий - это батарея. С каждым годом айфоны тоньше, дисплеи больше, но вот прогресс относительно продолжительности работы телефона без подзарядки, будто бы, стоит на месте. Касательно выпирающей камеры - после недели пользования шестеркой понял, что абсолютно никак она не мешает и уже привык как-то, поэтому недостатком сложно было назвать. А то многие так описывают ее, что ей чуть ли не в носу ковыряться можно)",4
94,"Что вы накинулись на идеальный гаджет? Это все придирки. Может быть сейчас много бОльших по функционалу Андроидов, но ИОС то ничем хуже не стал....Даже не буду описывать прекрасный экран, камеру и т.д. - вы и так это знаете. Батарейка держит в разы дольше моей бывшей 5ки. Размер, форма - по мне так идеален.Памяти хватит для долгие годы счастливого использования данного аппарата.Он определенно заслуживает оценки 5, если не делать скидку на цену. Лично я счастлива, что обладаю этим телефоном. Если вам больше нравится Андроид, пожалуйста! На вкус и цвет как говорится.",5
95,"Ну что сказать)? Кому то по душе ios, кому то  андроид, кому то windows! Я пользовался андроидом, сейчас пользуюсь ios. Мне понравилась ios. Поэтому пользуюсь ios! Хоть система и закрытая, но защищенная. И самое главное, что по душе! Хоть и дорогая)...Как сказал один мудрый чел: Главное ни конкуретноспособность этих трех систем, а их Успех и их Удача!!! Со мной же все согласны!?",4
96,"Судите сами. После iPhone 4s взял sony Z1 compact, затем sony Z3, samsung NOTE4, теперь вот iPhone 6s и впервые захотел написать отзыв. Ну взял андроид, закачал несколько фильмов (посмотрел раз, пока ехал в командировку в поезде), закачал несколько мелодий (для нарезки рингтонов), поигрался с настройками (потом стал  забывать где и что поменял), пофоткал немного (ради спортивного интереса), стилусом попользовался, что бы понять - нужен или нет, поставил карту памяти на 64Гб (просто фотки на неё сбрасывал). ВСЁ!!! Нажимаю на одну иконку-вызов идёт на другого чела, нажимаю на окончание разговора, появляется иконка, что идёт вызов (тому, кого только что сбросил), ну а включение вообще не удобное. А теперь всё иначе. Включение-молния, лагов пока вообще нет, может программы и дороговаты, но для меня это не критично (купил 5-7 приложений, мне больше не нужно). В сети работает гораздо шустрее (мои ощущения), фотки нормальные, тактильно вообще очень приятен, чехлы не использую принципиально, видео не снимал, ну и т.д. Словом скажу, что каждому своё. Всё в нём работает нормальненько так. Кому-то андроид очень нужен со своей открытой системой, кого-то полностью устраивает iPhone - такая сбалансированная система. Доволен, очень. На андроид не скоро перейду.",5
97,"Мой путь смартфонопользования начинался с виндовсбомайлов, но долго они у меня не задерживались, не мог привыкнуть и возвращался к простым телефонам. Потом пошли андроиды разных производителей - аппараты были хороши технически, но глючность и тормознутость андроида всё перечёркивала. Последней каплей был хтц, после которого от вёдер я зарёкся. Айфоны же до этого вообще не рассматривал.Вот после этого появился у меня 5, потом 5s и я понял, что для меня айфон это лучший выбор. Надёжность и качество. Я не любитель ковыряться в настройках и тюнинге. Для меня смартфон это средство, а не цель. Мне важно чтобы он хорошо и полноценно работал из коробки, а также важна безопасность в плане вирусов. На айфоне всё что нужно для кофмортной повседневной работы - уже установлено, это не ведроид с его бесконечными поисками качественного приложения среди гор мусора и вирусов на маркете. Да даже если и нужно скачать что-то из эппсторе, то качество приложений там на две головы выше, чем у гугла. Повторюсь: айось изначально полноценна, и не нуждается в костылях, файрволлах и антивирусах, как андроид.Удивительное дело, отдельными своими компонентами айфон хуже андроидов: где-то у вёдер экран сочнее и ярче, где то оперативки побольше, где-то корпус понадёжнее, где-то ещё какие свистелки. Но в итоге, как единое целое - айфон лучше всего остального, существующего на рынке смартфонов. Не знаю, как это у эпл получается.В общем, 5s я благополучно потерял, после чего передо мной встали муки выбора - снова 5s или 6. Пока думал, да читал инет, ходил с ведроидом на самсунге (приятель отдал), модель уточнять лень, с nfc чипом какой-то. В очередной раз убедился, насколько всё убого, неудобно и тормознуто происходит в ведре! После айоса это особенно заметно.Так вот, начитавшись и наслушавшись отрицательных отзыв про 6ку, хотел уж было взять проверенный 5s, но решил рискнуть - и не ошибся. айфон 6 - отличный аппарат, хорошее продолжение серии.",5
98,"отличный телефон, больше всего радует стабильность у устройств apple, до этого использовал iPhone 5s более 1 года, потом отдал его маме, за 1 год аппарат ни разу не подвис, не износился, (использовал его без чехла и всяких плёнок), сейчас ему уже 2 года все так=же стабильно. 6ым пользуюсь уже год, неподвел  ни разу.  Качество сборки отличное, ранял его 2 раза одни раз с высоты примерно 1.2 метра на кафель, ничего не треснуло. батарея держится шикарно в среднем хватает на полтора дня при активном использовании, в ожидании хватит дня на 2 с половиной, при постоянно включённом 4g с переходом на wifi. Для тех у кого проблема с быстро садящейся  батарей совет: надо перейти в настройки - конфедициальность - службы геолокации, спуститься в низ до вкладки системные службы, и отключить там: геолокационные aid, геопредупреждения, калибровка компаса, диагностика и использование, маршрутизация и трафик, популярное рядом! Тогда батарея будет держаться на 60?ольше",5
99,"Отличный, как и все айфоны, но цены очень высока.",5
100,"Кардинальных отличий, кроме размера экрана, от Iphone 5 нет. Очень нравится размер экрана, можно читать книги и не портить зрение.Классный звук, очень громкие динамики.Дизайн классный, причем нравятся белые полоски (взяла Gold), которые все так сильно критикуют:)Успела заказать в последний день за 32 000, сейчас он уже 39 990.Вцелом впечатления положительные-скромный, удобный, красивый, прочный, легкий телефон. Но, к сожалению, по-моему субъективному мнению даже 32 т. это много...",4
101,"iPhone 6 практически идеален. Отличный дизайн,экран. Самое главное это iOS она вообще не глючит даже нет намека на ЛАГ. Наконец Apple сделала большой дисплей, теперь даже не думаю возвращается к зеленому роботу))",5
102,"Это мой третий айфон по счету и последний. Больно уж много стало косяков. На что переходить не знаю, свои проблемы есть в любой системе, а было все.",4
